{
  "schema_version": 1,
  "id": "PER-jordan-lee",
  "entity_type": "person",
  "title": "Jordan Lee",
  "uri": "workctx://fictional-context/person/PER-jordan-lee",
  "aliases": [
    "J. Lee"
  ],
  "status": "active",
  "confidence": "high",
  "tags": [
    "fictional"
  ],
  "references": [
    {
      "relation": "related_to",
      "target": "workctx://fictional-context/project/PRJ-sample",
      "confidence": "medium"
    }
  ],
  "created_at": "2026-07-30T12:00:00Z",
  "updated_at": "2026-07-30T12:00:00Z"
}
